{
  "budgetId": "PERF-BUDGET-015",
  "name": "Relationship render bound",
  "category": "relationships",
  "scope": "contract-portal",
  "metric": "relationships.maxRenderedNeighbors",
  "target": 80,
  "warningThreshold": 100,
  "comparator": "lte",
  "unit": "count",
  "applicability": [
    "contract-portal"
  ],
  "measurementMethod": "config-inspection",
  "environment": "Hosted and file review",
  "notes": "Prevents unbounded graph rendering on high-degree Registry nodes.",
  "relatedRegistryIds": [
    "relationships.relationshipConfiguration"
  ],
  "version": "1.1.0",
  "status": "stable",
  "phase": 32,
  "sourceReference": "registry/performance/budgets/perf_budget_015.json"
}
